{
  "compactified_points": [
    "1/2",
    "1/5",
    "1/10"
  ],
  "hankel_leading_principal_minors": [
    "4/5",
    "43/2500",
    "9/6250000",
    "0",
    "0"
  ],
  "hankel_matrix": [
    [
      "4/5",
      "3/10",
      "67/500",
      "321/5000",
      "1579/50000"
    ],
    [
      "3/10",
      "67/500",
      "321/5000",
      "1579/50000",
      "1569/100000"
    ],
    [
      "67/500",
      "321/5000",
      "1579/50000",
      "1569/100000",
      "39127/5000000"
    ],
    [
      "321/5000",
      "1579/50000",
      "1569/100000",
      "39127/5000000",
      "195441/50000000"
    ],
    [
      "1579/50000",
      "1569/100000",
      "39127/5000000",
      "195441/50000000",
      "976819/500000000"
    ]
  ],
  "localizing_leading_principal_minors": [
    "1/2",
    "459/62500",
    "81/156250000",
    "0",
    "0"
  ],
  "localizing_matrix": [
    [
      "1/2",
      "83/500",
      "349/5000",
      "1631/50000",
      "1589/100000"
    ],
    [
      "83/500",
      "349/5000",
      "1631/50000",
      "1589/100000",
      "39323/5000000"
    ],
    [
      "349/5000",
      "1631/50000",
      "1589/100000",
      "39323/5000000",
      "195829/50000000"
    ],
    [
      "1631/50000",
      "1589/100000",
      "39323/5000000",
      "195829/50000000",
      "977591/500000000"
    ],
    [
      "1589/100000",
      "39323/5000000",
      "195829/50000000",
      "977591/500000000",
      "976973/1000000000"
    ]
  ],
  "moments": [
    "4/5",
    "3/10",
    "67/500",
    "321/5000",
    "1579/50000",
    "1569/100000",
    "39127/5000000",
    "195441/50000000",
    "976819/500000000",
    "195333/200000000",
    "24415087/50000000000"
  ],
  "rank_hankel": 3,
  "rank_localizing": 3,
  "signed_differences": {
    "k=0,n=0": "4/5",
    "k=0,n=1": "3/10",
    "k=0,n=2": "67/500",
    "k=0,n=3": "321/5000",
    "k=0,n=4": "1579/50000",
    "k=0,n=5": "1569/100000",
    "k=1,n=0": "1/2",
    "k=1,n=1": "83/500",
    "k=1,n=2": "349/5000",
    "k=1,n=3": "1631/50000",
    "k=1,n=4": "1589/100000",
    "k=1,n=5": "39323/5000000",
    "k=2,n=0": "167/500",
    "k=2,n=1": "481/5000",
    "k=2,n=2": "1859/50000",
    "k=2,n=3": "1673/100000",
    "k=2,n=4": "40127/5000000",
    "k=2,n=5": "197401/50000000",
    "k=3,n=0": "1189/5000",
    "k=3,n=1": "2951/50000",
    "k=3,n=2": "409/20000",
    "k=3,n=3": "43523/5000000",
    "k=3,n=4": "203869/50000000",
    "k=3,n=5": "993311/500000000",
    "k=4,n=0": "8939/50000",
    "k=4,n=1": "3857/100000",
    "k=4,n=2": "58727/5000000",
    "k=4,n=3": "231361/50000000",
    "k=4,n=4": "1045379/500000000",
    "k=4,n=5": "1003433/1000000000",
    "k=5,n=0": "14021/100000",
    "k=5,n=1": "134123/5000000",
    "k=5,n=2": "355909/50000000",
    "k=5,n=3": "1268231/500000000",
    "k=5,n=4": "43493/40000000",
    "k=5,n=5": "25492163/50000000000"
  },
  "spectrum": [
    "1",
    "4",
    "9"
  ],
  "status": "exact toy certificate; not an RH certificate",
  "weights": [
    "1/2",
    "1/5",
    "1/10"
  ],
  "x0": "1"
}